criteria,attempts_per_game,fg_percent,expected_fgs,category
"Avg per team, per game",1.9305613305613305,0.8440663364204178,1.6295218295218294,Stadium
in a dome,2.0071301247771838,0.8454706927175843,1.696969696969697,Environment
in below freezing temperature,1.803191489361702,0.8348082595870207,1.5053191489361701,Environment
in the cold (32f-55f),1.9210069444444444,0.8431992769995481,1.6197916666666665,Environment
in the heat (over 80f),1.9578651685393258,0.8321377331420373,1.6292134831460674,Environment
in low wind(under 5 mph),1.9061696658097687,0.8718813216453135,1.6619537275064267,Environment
in medium wind (5-10 mph),2.0050420168067227,0.8419949706621962,1.688235294117647,Environment
in high wind (over 10mph),1.920042643923241,0.8334258745141588,1.6002132196162049,Environment
with over/under below 40,1.9351851851851851,0.8341307814992025,1.6141975308641974,Environment
with over/under between 40 and 45,1.9595842956120093,0.8461991750147319,1.6581986143187066,Environment
with over/under between 45 and 50,1.9691435768261965,0.8423409018228334,1.6586901763224182,Environment
with over/under over 50,1.9357541899441342,0.8492063492063492,1.643854748603352,Environment
in home games,1.9355509355509355,0.8481203007518797,1.6415800415800417,Environment
in away games,1.9255717255717255,0.8399913625566833,1.6174636174636174,Environment
"in all games at ""MetLife Stadium""",2.2595419847328246,0.8716216216216216,1.969465648854962,Stadium
"in all games at ""Soldier Field""",1.856164383561644,0.8265682656826568,1.534246575342466,Stadium
"in all games at ""FirstEnergy Stadium""",1.7681159420289856,0.8155737704918032,1.4420289855072463,Stadium
"in all games at ""Arrowhead Stadium""",1.9545454545454546,0.8272425249169435,1.6168831168831168,Stadium
"in all games at ""Ford Field""",2.0140845070422535,0.8146853146853147,1.6408450704225352,Stadium
"in all games at ""Mercedes-Benz Superdome""",1.9423076923076923,0.8316831683168316,1.6153846153846152,Stadium
"in all games at ""NRG Stadium""",2.039473684210526,0.8612903225806452,1.756578947368421,Stadium
"in all games at ""Nissan Stadium""",1.8732394366197183,0.849624060150376,1.5915492957746478,Stadium
"in all games at ""Mall of America Field at HHH Metrodome""",2.0357142857142856,0.8947368421052632,1.8214285714285714,Stadium
"in all games at ""Raymond James Stadium""",1.9859154929577465,0.776595744680851,1.5422535211267605,Stadium
"in all games at ""University of Phoenix Stadium""",1.9396551724137931,0.8044444444444444,1.5603448275862069,Stadium
"in all games at ""Lambeau Field""",1.8266666666666667,0.8467153284671532,1.5466666666666666,Stadium
"in all games at ""Mile High""",1.981012658227848,0.8338658146964856,1.6518987341772151,Stadium
"in all games at ""M&T Bank Stadium""",2.0945945945945947,0.832258064516129,1.7432432432432434,Stadium
"in all games at ""O.co Coliseum Oakland""",2.0641025641025643,0.8074534161490683,1.6666666666666667,Stadium
"in all games at ""Paul Brown Stadium""",2.0555555555555554,0.8716216216216216,1.7916666666666665,Stadium
"in all games at ""New Era Stadium""",1.9583333333333333,0.8368794326241135,1.6388888888888888,Stadium
"in all games at ""Lucas Oil Stadium""",2.0273972602739727,0.8445945945945946,1.7123287671232879,Stadium
"in all games at ""Lincoln Financial Field""",1.9266666666666667,0.8512110726643599,1.6400000000000001,Stadium
"in all games at ""EverBank Field""",2.0697674418604652,0.8764044943820225,1.8139534883720931,Stadium
"in all games at ""Bank of America Stadium""",2.0,0.8533333333333334,1.7066666666666668,Stadium
"in all games at ""Gillette Stadium""",2.0123456790123457,0.8496932515337423,1.7098765432098766,Stadium
"in all games at ""Edward Jones Dome""",2.1,0.8333333333333334,1.7500000000000002,Stadium
"in all games at ""CenturyLink Field""",1.8355263157894737,0.8566308243727598,1.5723684210526316,Stadium
"in all games at ""Qualcomm Stadium""",1.8125,0.8620689655172413,1.5625,Stadium
"in all games at ""Sun Life Stadium""",2.0125,0.7888198757763976,1.5875000000000001,Stadium
"in all games at ""Heinz Field""",1.8289473684210527,0.8812949640287769,1.6118421052631577,Stadium
"in all games at ""Candlestick Park""",2.1176470588235294,0.8194444444444444,1.7352941176470589,Stadium
"in all games at ""Georgia Dome""",2.0,0.8837209302325582,1.7674418604651163,Stadium
"in all games at ""AT&T Stadium""",1.9866666666666666,0.8691275167785235,1.7266666666666666,Stadium
"in all games at ""FedEx Field""",1.82,0.8315018315018315,1.5133333333333334,Stadium
"in all games at ""Wembley Stadium""",1.5625,0.84,1.3125,Stadium
"in all games at ""TCF Bank Stadium""",2.0294117647058822,0.8695652173913043,1.7647058823529411,Stadium
"in all games at ""Levi's Stadium""",1.9272727272727272,0.8726415094339622,1.6818181818181817,Stadium
"in all games at ""Los Angeles Memorial Coliseum""",2.0517241379310347,0.8487394957983193,1.7413793103448276,Stadium
"in all games at ""U.S. Bank Stadium""",2.0,0.8658536585365854,1.7317073170731707,Stadium
"in all games at ""New Era Field""",1.8823529411764706,0.8046875,1.5147058823529411,Stadium
"in all games at ""StubHub Center""",2.392857142857143,0.8208955223880597,1.9642857142857144,Stadium
"in all games at ""Oakland-Alameda County Coliseum""",1.8095238095238095,0.7763157894736842,1.4047619047619047,Stadium
"in all games at ""Mercedes-Benz Stadium""",2.1666666666666665,0.8811188811188811,1.909090909090909,Stadium
"in all games at ""Hard Rock Stadium""",1.8064516129032258,0.8035714285714286,1.4516129032258065,Stadium
"in all games at ""TIAA Bank Field""",1.8695652173913044,0.8953488372093024,1.673913043478261,Stadium
"in all games at ""Dignity Health Sports Park""",2.0714285714285716,0.7586206896551724,1.5714285714285714,Stadium
"in all games at ""State Farm Stadium""",2.0588235294117645,0.8428571428571429,1.7352941176470587,Stadium
"in all games at ""SoFi Stadium""",2.392857142857143,0.8507462686567164,2.0357142857142856,Stadium
"in all games at ""Allegiant Stadium""",2.125,0.9411764705882353,2.0,Stadium
in home games at MetLife Stadium,2.0381679389312977,0.8689138576779026,1.7709923664122138,Stadium
in home games at Soldier Field,1.7808219178082192,0.8153846153846154,1.452054794520548,Stadium
in home games at FirstEnergy Stadium,1.6521739130434783,0.7894736842105263,1.3043478260869565,Stadium
in home games at Arrowhead Stadium,2.038961038961039,0.8343949044585988,1.7012987012987013,Stadium
in home games at Ford Field,1.9859154929577465,0.8723404255319149,1.7323943661971832,Stadium
in home games at Mercedes-Benz Superdome,1.8846153846153846,0.8027210884353742,1.5128205128205128,Stadium
in home games at NRG Stadium,2.1710526315789473,0.8545454545454545,1.8552631578947367,Stadium
in home games at Nissan Stadium,1.7464788732394365,0.8145161290322581,1.4225352112676057,Stadium
in home games at Mall of America Field at HHH Metrodome,2.0714285714285716,0.9310344827586207,1.9285714285714286,Stadium
in home games at Raymond James Stadium,1.8450704225352113,0.7404580152671756,1.3661971830985915,Stadium
in home games at University of Phoenix Stadium,2.0689655172413794,0.8083333333333333,1.6724137931034484,Stadium
in home games at Lambeau Field,1.8666666666666667,0.8642857142857143,1.6133333333333335,Stadium
in home games at Mile High,2.1392405063291138,0.8284023668639053,1.7721518987341771,Stadium
in home games at M&T Bank Stadium,2.2837837837837838,0.8698224852071006,1.9864864864864864,Stadium
in home games at O.co Coliseum Oakland,2.076923076923077,0.7777777777777778,1.6153846153846156,Stadium
in home games at Paul Brown Stadium,1.8888888888888888,0.8529411764705882,1.611111111111111,Stadium
in home games at New Era Stadium,1.9444444444444444,0.8571428571428571,1.6666666666666665,Stadium
in home games at Lucas Oil Stadium,2.095890410958904,0.8562091503267973,1.7945205479452053,Stadium
in home games at Lincoln Financial Field,1.96,0.8571428571428571,1.68,Stadium
in home games at EverBank Field,1.9534883720930232,0.8690476190476191,1.697674418604651,Stadium
in home games at Bank of America Stadium,1.9333333333333333,0.8689655172413793,1.68,Stadium
in home games at Gillette Stadium,2.1358024691358026,0.8959537572254336,1.9135802469135805,Stadium
in home games at Edward Jones Dome,2.066666666666667,0.8548387096774194,1.7666666666666668,Stadium
in home games at CenturyLink Field,1.881578947368421,0.8671328671328671,1.631578947368421,Stadium
in home games at Qualcomm Stadium,2.0,0.8875,1.775,Stadium
in home games at Sun Life Stadium,1.775,0.8028169014084507,1.425,Stadium
in home games at Heinz Field,2.0,0.9078947368421053,1.8157894736842106,Stadium
in home games at Candlestick Park,2.3529411764705883,0.85,2.0,Stadium
in home games at Georgia Dome,2.186046511627907,0.8829787234042553,1.9302325581395348,Stadium
in home games at AT&T Stadium,2.1333333333333333,0.86875,1.8533333333333333,Stadium
in home games at FedEx Field,1.7733333333333334,0.8345864661654135,1.4800000000000002,Stadium
in home games at Wembley Stadium,1.3125,0.8571428571428571,1.125,Stadium
in home games at TCF Bank Stadium,1.9411764705882353,0.8484848484848485,1.647058823529412,Stadium
in home games at Levi's Stadium,2.0,0.9,1.8,Stadium
in home games at Los Angeles Memorial Coliseum,2.206896551724138,0.84375,1.8620689655172413,Stadium
in home games at U.S. Bank Stadium,1.829268292682927,0.84,1.5365853658536586,Stadium
in home games at New Era Field,1.911764705882353,0.7846153846153846,1.5,Stadium
in home games at StubHub Center,2.7857142857142856,0.7948717948717948,2.214285714285714,Stadium
in home games at Oakland-Alameda County Coliseum,1.7142857142857142,0.75,1.2857142857142856,Stadium
in home games at Mercedes-Benz Stadium,2.4242424242424243,0.8625,2.0909090909090913,Stadium
in home games at Hard Rock Stadium,1.5483870967741935,0.8125,1.2580645161290323,Stadium
in home games at TIAA Bank Field,1.7826086956521738,0.926829268292683,1.6521739130434783,Stadium
in home games at Dignity Health Sports Park,2.142857142857143,0.8,1.7142857142857144,Stadium
in home games at State Farm Stadium,1.9411764705882353,0.8484848484848485,1.647058823529412,Stadium
in home games at SoFi Stadium,2.4285714285714284,0.8235294117647058,1.9999999999999998,Stadium
in home games at Allegiant Stadium,2.375,1.0,2.375,Stadium
in away games at MetLife Stadium,2.480916030534351,0.8738461538461538,2.16793893129771,Stadium
in away games at Soldier Field,1.9315068493150684,0.8368794326241135,1.6164383561643836,Stadium
in away games at FirstEnergy Stadium,1.8840579710144927,0.8384615384615385,1.5797101449275361,Stadium
in away games at Arrowhead Stadium,1.87012987012987,0.8194444444444444,1.5324675324675323,Stadium
in away games at Ford Field,2.0422535211267605,0.7586206896551724,1.5492957746478873,Stadium
in away games at Mercedes-Benz Superdome,2.0,0.8589743589743589,1.7179487179487178,Stadium
in away games at NRG Stadium,1.9078947368421053,0.8689655172413793,1.6578947368421053,Stadium
in away games at Nissan Stadium,2.0,0.8802816901408451,1.7605633802816902,Stadium
in away games at Mall of America Field at HHH Metrodome,2.0,0.8571428571428571,1.7142857142857142,Stadium
in away games at Raymond James Stadium,2.1267605633802815,0.8079470198675497,1.7183098591549295,Stadium
in away games at University of Phoenix Stadium,1.8103448275862069,0.8,1.4482758620689655,Stadium
in away games at Lambeau Field,1.7866666666666666,0.8283582089552238,1.48,Stadium
in away games at Mile High,1.8227848101265822,0.8402777777777778,1.5316455696202531,Stadium
in away games at M&T Bank Stadium,1.9054054054054055,0.7872340425531915,1.5,Stadium
in away games at O.co Coliseum Oakland,2.051282051282051,0.8375,1.7179487179487178,Stadium
in away games at Paul Brown Stadium,2.2222222222222223,0.8875,1.9722222222222223,Stadium
in away games at New Era Stadium,1.9722222222222223,0.8169014084507042,1.6111111111111112,Stadium
in away games at Lucas Oil Stadium,1.9589041095890412,0.8321678321678322,1.63013698630137,Stadium
in away games at Lincoln Financial Field,1.8933333333333333,0.8450704225352113,1.5999999999999999,Stadium
in away games at EverBank Field,2.186046511627907,0.8829787234042553,1.9302325581395348,Stadium
in away games at Bank of America Stadium,2.066666666666667,0.8387096774193549,1.7333333333333336,Stadium
in away games at Gillette Stadium,1.8888888888888888,0.7973856209150327,1.5061728395061729,Stadium
in away games at Edward Jones Dome,2.1333333333333333,0.8125,1.7333333333333334,Stadium
in away games at CenturyLink Field,1.7894736842105263,0.8455882352941176,1.513157894736842,Stadium
in away games at Qualcomm Stadium,1.625,0.8307692307692308,1.35,Stadium
in away games at Sun Life Stadium,2.25,0.7777777777777778,1.75,Stadium
in away games at Heinz Field,1.6578947368421053,0.8492063492063492,1.4078947368421053,Stadium
in away games at Candlestick Park,1.8823529411764706,0.78125,1.4705882352941175,Stadium
in away games at Georgia Dome,1.813953488372093,0.8846153846153846,1.6046511627906974,Stadium
in away games at AT&T Stadium,1.84,0.8695652173913043,1.6,Stadium
in away games at FedEx Field,1.8666666666666667,0.8285714285714286,1.5466666666666669,Stadium
in away games at Wembley Stadium,1.8125,0.8275862068965517,1.5,Stadium
in away games at TCF Bank Stadium,2.1176470588235294,0.8888888888888888,1.8823529411764706,Stadium
in away games at Levi's Stadium,1.8545454545454545,0.8431372549019608,1.5636363636363635,Stadium
in away games at Los Angeles Memorial Coliseum,1.896551724137931,0.8545454545454545,1.6206896551724137,Stadium
in away games at U.S. Bank Stadium,2.1707317073170733,0.8876404494382022,1.9268292682926829,Stadium
in away games at New Era Field,1.8529411764705883,0.8253968253968254,1.5294117647058822,Stadium
in away games at StubHub Center,2.0,0.8571428571428571,1.7142857142857142,Stadium
in away games at Oakland-Alameda County Coliseum,1.9047619047619047,0.8,1.5238095238095237,Stadium
in away games at Mercedes-Benz Stadium,1.9090909090909092,0.9047619047619048,1.7272727272727273,Stadium
in away games at Hard Rock Stadium,2.064516129032258,0.796875,1.6451612903225805,Stadium
in away games at TIAA Bank Field,1.9565217391304348,0.8666666666666667,1.6956521739130435,Stadium
in away games at Dignity Health Sports Park,2.0,0.7142857142857143,1.4285714285714286,Stadium
in away games at State Farm Stadium,2.176470588235294,0.8378378378378378,1.8235294117647056,Stadium
in away games at SoFi Stadium,2.357142857142857,0.8787878787878788,2.0714285714285716,Stadium
in away games at Allegiant Stadium,1.875,0.8666666666666667,1.625,Stadium
"""Lawrence Tynes""",2.7857142857142856,0.8461538461538461,2.357142857142857,Kicker
"""Dan Bailey""",2.1475409836065573,0.8549618320610687,1.8360655737704916,Kicker
"""Robbie Gould""",2.219298245614035,0.8774703557312253,1.9473684210526316,Kicker
"""Adam Vinatieri""",2.2869565217391306,0.8479087452471483,1.9391304347826088,Kicker
"""Phil Dawson""",2.258426966292135,0.8557213930348259,1.9325842696629214,Kicker
"""Alex Henery""",2.129032258064516,0.7878787878787878,1.6774193548387095,Kicker
"""Ryan Succop""",2.05,0.8455284552845529,1.7333333333333332,Kicker
"""Matt Bryant""",2.2242990654205608,0.8781512605042017,1.9532710280373833,Kicker
"""Nick Folk""",2.225806451612903,0.8405797101449275,1.8709677419354835,Kicker
"""Greg Zuerlein""",2.466666666666667,0.8209459459459459,2.025,Kicker
"""Jason Hanson""",2.5714285714285716,0.8888888888888888,2.2857142857142856,Kicker
"""Billy Cundiff""",2.0303030303030303,0.746268656716418,1.5151515151515151,Kicker
"""Garrett Hartley""",1.9642857142857142,0.7818181818181819,1.5357142857142858,Kicker
"""Shayne Graham""",2.4166666666666665,0.8390804597701149,2.0277777777777777,Kicker
"""Dan Carpenter""",2.1857142857142855,0.8562091503267973,1.8714285714285712,Kicker
"""Rob Bironas""",2.4,0.8333333333333334,2.0,Kicker
"""Stephen Gostkowski""",2.3656716417910446,0.8769716088328076,2.074626865671642,Kicker
"""Josh Scobee""",2.022727272727273,0.8314606741573034,1.681818181818182,Kicker
"""Blair Walsh""",2.4,0.8229166666666666,1.9749999999999999,Kicker
"""Connor Barth""",2.185185185185185,0.8220338983050848,1.7962962962962963,Kicker
"""Stephen Hauschka""",2.2283464566929134,0.872791519434629,1.9448818897637796,Kicker
"""Jay Feely""",2.3448275862068964,0.8529411764705882,1.9999999999999998,Kicker
"""David Akers""",2.1515151515151514,0.7323943661971831,1.5757575757575757,Kicker
"""Shaun Suisham""",2.2790697674418605,0.9183673469387755,2.0930232558139537,Kicker
"""Matt Prater""",2.1953125,0.8505338078291815,1.8671875,Kicker
"""Justin Tucker""",2.404255319148936,0.8997050147492626,2.1631205673758864,Kicker
"""Mike Nugent""",2.0843373493975905,0.815028901734104,1.6987951807228916,Kicker
"""Sebastian Janikowski""",2.185185185185185,0.8192090395480226,1.7901234567901234,Kicker
"""Mason Crosby""",2.1374045801526718,0.8428571428571429,1.801526717557252,Kicker
"""Rian Lindell""",1.8928571428571428,0.8301886792452831,1.5714285714285714,Kicker
"""Nick Novak""",2.2567567567567566,0.8622754491017964,1.9459459459459458,Kicker
"""Kai Forbath""",2.0789473684210527,0.8607594936708861,1.7894736842105263,Kicker
"""Graham Gano""",2.2641509433962264,0.8666666666666667,1.9622641509433962,Kicker
"""Josh Brown""",2.4444444444444446,0.9181818181818182,2.244444444444445,Kicker
"""Caleb Sturgis""",2.4193548387096775,0.8,1.935483870967742,Kicker
"""Randy Bullock""",2.082474226804124,0.8316831683168316,1.731958762886598,Kicker
"""Cairo Santos""",2.276315789473684,0.838150289017341,1.907894736842105,Kicker
"""Cody Parkey""",2.0,0.8466666666666667,1.6933333333333334,Kicker
"""Brandon McManus""",2.2142857142857144,0.8248847926267281,1.826530612244898,Kicker
"""Chandler Catanzaro""",2.1818181818181817,0.8402777777777778,1.8333333333333333,Kicker
"""Patrick Murray""",1.8846153846153846,0.8163265306122449,1.5384615384615385,Kicker
"""Travis Coons""",2.5,0.875,2.1875,Kicker
"""Andrew Franks""",1.6956521739130435,0.7948717948717948,1.3478260869565217,Kicker
"""Jason Myers""",2.2467532467532467,0.8554913294797688,1.922077922077922,Kicker
"""Josh Lambo""",2.0555555555555554,0.8918918918918919,1.833333333333333,Kicker
"""Dustin Hopkins""",2.275,0.8406593406593407,1.9124999999999999,Kicker
"""Chris Boswell""",2.2195121951219514,0.8901098901098901,1.975609756097561,Kicker
"""Wil Lutz""",2.2658227848101267,0.8547486033519553,1.9367088607594938,Kicker
"""Roberto Aguayo""",2.2142857142857144,0.7096774193548387,1.5714285714285716,Kicker
"""Giorgio Tavecchio""",1.625,0.8076923076923077,1.3125,Kicker
"""Zane Gonzalez""",2.0681818181818183,0.7802197802197802,1.6136363636363638,Kicker
"""Aldrick Rosas""",1.8695652173913044,0.813953488372093,1.5217391304347827,Kicker
"""Younghoe Koo""",2.730769230769231,0.8873239436619719,2.4230769230769234,Kicker
"""Ka'imi Fairbairn""",2.309090909090909,0.84251968503937,1.9454545454545453,Kicker
"""Jake Elliott""",1.903225806451613,0.8389830508474576,1.5967741935483872,Kicker
"""Harrison Butker""",2.370967741935484,0.8979591836734694,2.129032258064516,Kicker
"""Sam Ficken""",2.0833333333333335,0.74,1.5416666666666667,Kicker
"""Jason Sanders""",2.3421052631578947,0.8651685393258427,2.026315789473684,Kicker
"""Daniel Carlson""",1.9523809523809523,0.8414634146341463,1.6428571428571428,Kicker
"""Brett Maher""",2.3448275862068964,0.7352941176470589,1.7241379310344827,Kicker
"""Greg Joseph""",1.9090909090909092,0.8571428571428571,1.6363636363636362,Kicker
"""Michael Badgley""",2.3666666666666667,0.8028169014084507,1.9000000000000001,Kicker
"""Eddy Pineiro""",2.1538461538461537,0.8214285714285714,1.7692307692307692,Kicker
"""Joey Slye""",2.310344827586207,0.8059701492537313,1.8620689655172413,Kicker
"""Matt Gay""",2.2,0.8181818181818182,1.8000000000000003,Kicker
"""Austin Seibert""",2.111111111111111,0.8157894736842105,1.7222222222222223,Kicker
"""Chase McLaughlin""",2.1538461538461537,0.7857142857142857,1.6923076923076923,Kicker
"""Rodrigo Blankenship""",2.6,0.8461538461538461,2.2,Kicker
"""Tyler Bass""",2.5294117647058822,0.813953488372093,2.0588235294117645,Kicker
"against ""2012"" ""NYG"" defense",1.875,0.8666666666666667,1.625,Defense
"against ""2012"" ""DAL"" defense",2.0625,0.8787878787878788,1.8125,Defense
"against ""2012"" ""CHI"" defense",1.6875,0.8518518518518519,1.4375,Defense
"against ""2012"" ""IND"" defense",2.625,0.7857142857142857,2.0625,Defense
"against ""2012"" ""CLE"" defense",1.5,0.8333333333333334,1.25,Defense
"against ""2012"" ""PHI"" defense",1.8125,0.9310344827586207,1.6875,Defense
"against ""2012"" ""KC"" defense",2.375,0.8421052631578947,2.0,Defense
"against ""2012"" ""ATL"" defense",2.0625,0.8181818181818182,1.6875,Defense
"against ""2012"" ""NYJ"" defense",1.9375,0.7096774193548387,1.375,Defense
"against ""2012"" ""STL-LA"" defense",2.3125,0.8108108108108109,1.875,Defense
"against ""2012"" ""DET"" defense",2.5625,0.7560975609756098,1.9375,Defense
"against ""2012"" ""WAS"" defense",2.0625,0.9393939393939394,1.9375,Defense
"against ""2012"" ""NO"" defense",2.0625,0.8181818181818182,1.6875,Defense
"against ""2012"" ""HOU"" defense",1.75,0.8928571428571429,1.5625,Defense
"against ""2012"" ""MIA"" defense",2.5,0.775,1.9375,Defense
"against ""2012"" ""TEN"" defense",1.9375,0.9354838709677419,1.8125,Defense
"against ""2012"" ""NE"" defense",1.6875,0.8518518518518519,1.4375,Defense
"against ""2012"" ""JAC"" defense",2.6875,0.8372093023255814,2.25,Defense
"against ""2012"" ""MIN"" defense",1.9375,0.8387096774193549,1.625,Defense
"against ""2012"" ""TB"" defense",1.75,0.6785714285714286,1.1875,Defense
"against ""2012"" ""CAR"" defense",2.3125,0.9459459459459459,2.1875,Defense
"against ""2012"" ""SEA"" defense",1.75,0.9285714285714286,1.625,Defense
"against ""2012"" ""ARI"" defense",2.1875,0.7142857142857143,1.5625,Defense
"against ""2012"" ""SF"" defense",1.9375,0.8387096774193549,1.625,Defense
"against ""2012"" ""PIT"" defense",2.0625,0.8484848484848485,1.75,Defense
"against ""2012"" ""DEN"" defense",1.625,0.8846153846153846,1.4375,Defense
"against ""2012"" ""BAL"" defense",2.5789473684210527,0.9183673469387755,2.368421052631579,Defense
"against ""2012"" ""CIN"" defense",2.1176470588235294,0.8611111111111112,1.823529411764706,Defense
"against ""2012"" ""OAK-LV"" defense",2.3125,0.8378378378378378,1.9375,Defense
"against ""2012"" ""SD-LAC"" defense",1.3125,0.9047619047619048,1.1875,Defense
"against ""2012"" ""GB"" defense",2.0,0.875,1.75,Defense
"against ""2012"" ""BUF"" defense",1.75,0.75,1.3125,Defense
"against ""2013"" ""NYG"" defense",1.875,0.9666666666666667,1.8125,Defense
"against ""2013"" ""DAL"" defense",1.8125,0.8620689655172413,1.5625,Defense
"against ""2013"" ""CHI"" defense",1.875,0.9333333333333333,1.75,Defense
"against ""2013"" ""IND"" defense",2.0625,0.7878787878787878,1.625,Defense
"against ""2013"" ""CLE"" defense",2.0,0.84375,1.6875,Defense
"against ""2013"" ""PHI"" defense",2.25,0.8611111111111112,1.9375,Defense
"against ""2013"" ""KC"" defense",1.8125,0.7931034482758621,1.4375,Defense
"against ""2013"" ""ATL"" defense",2.1875,0.9714285714285714,2.125,Defense
"against ""2013"" ""NYJ"" defense",2.3125,0.8918918918918919,2.0625,Defense
"against ""2013"" ""STL-LA"" defense",1.625,0.6923076923076923,1.125,Defense
"against ""2013"" ""DET"" defense",2.5,0.925,2.3125,Defense
"against ""2013"" ""WAS"" defense",1.5625,0.84,1.3125,Defense
"against ""2013"" ""NO"" defense",1.9411764705882353,0.8484848484848485,1.647058823529412,Defense
"against ""2013"" ""HOU"" defense",2.1875,0.8571428571428571,1.875,Defense
"against ""2013"" ""MIA"" defense",2.5,0.85,2.125,Defense
"against ""2013"" ""TEN"" defense",2.4375,0.8205128205128205,2.0,Defense
"against ""2013"" ""NE"" defense",1.9411764705882353,0.8484848484848485,1.647058823529412,Defense
"against ""2013"" ""JAC"" defense",1.8125,0.896551724137931,1.625,Defense
"against ""2013"" ""MIN"" defense",1.8125,0.9310344827586207,1.6875,Defense
"against ""2013"" ""TB"" defense",2.0,0.96875,1.9375,Defense
"against ""2013"" ""CAR"" defense",2.176470588235294,0.8918918918918919,1.941176470588235,Defense
"against ""2013"" ""SEA"" defense",1.875,0.9,1.6875,Defense
"against ""2013"" ""ARI"" defense",2.0,0.78125,1.5625,Defense
"against ""2013"" ""SF"" defense",1.9375,0.8387096774193549,1.625,Defense
"against ""2013"" ""PIT"" defense",1.9375,0.9032258064516129,1.75,Defense
"against ""2013"" ""DEN"" defense",1.9375,0.8709677419354839,1.6875,Defense
"against ""2013"" ""BAL"" defense",2.1875,0.9142857142857143,2.0,Defense
"against ""2013"" ""CIN"" defense",2.0625,0.8484848484848485,1.75,Defense
"against ""2013"" ""OAK-LV"" defense",1.75,0.8928571428571429,1.5625,Defense
"against ""2013"" ""SD-LAC"" defense",2.0625,0.7575757575757576,1.5625,Defense
"against ""2013"" ""GB"" defense",2.0625,0.8181818181818182,1.6875,Defense
"against ""2013"" ""BUF"" defense",2.25,0.8611111111111112,1.9375,Defense
"against ""2014"" ""NYG"" defense",1.9375,0.9354838709677419,1.8125,Defense
"against ""2014"" ""DAL"" defense",1.375,0.9090909090909091,1.25,Defense
"against ""2014"" ""CHI"" defense",2.4375,0.8461538461538461,2.0625,Defense
"against ""2014"" ""IND"" defense",1.4375,0.8260869565217391,1.1875,Defense
"against ""2014"" ""CLE"" defense",2.125,0.8529411764705882,1.8125,Defense
"against ""2014"" ""PHI"" defense",1.6875,0.8148148148148148,1.375,Defense
"against ""2014"" ""KC"" defense",2.3125,0.8648648648648649,2.0,Defense
"against ""2014"" ""ATL"" defense",2.375,0.8157894736842105,1.9375,Defense
"against ""2014"" ""NYJ"" defense",2.0,0.8125,1.625,Defense
"against ""2014"" ""STL-LA"" defense",1.8125,0.8620689655172413,1.5625,Defense
"against ""2014"" ""DET"" defense",1.5625,0.76,1.1875,Defense
"against ""2014"" ""WAS"" defense",1.625,0.8461538461538461,1.375,Defense
"against ""2014"" ""NO"" defense",2.0,0.96875,1.9375,Defense
"against ""2014"" ""HOU"" defense",1.375,0.8636363636363636,1.1875,Defense
"against ""2014"" ""MIA"" defense",2.125,0.7647058823529411,1.625,Defense
"against ""2014"" ""TEN"" defense",2.4375,0.8461538461538461,2.0625,Defense
"against ""2014"" ""NE"" defense",2.5,0.775,1.9375,Defense
